{
  "type": "array",
  "$schema": "https://json-schema.org/draft/2020-12/schema",
  "items": {
    "type": "object",
    "required": [
      "additional_icons",
      "advert",
      "categories",
      "gradient_end",
      "gradient_start",
      "id",
      "image_link",
      "name",
      "products",
      "title_color",
      "type"
    ],
    "properties": {
      "additional_icons": {
        "type": "array",
        "items": {}
      },
      "advert": {
        "type": "null"
      },
      "categories": {
        "type": "array",
        "items": {
          "type": "object",
          "required": [
            "additional_icons",
            "advert",
            "category_type",
            "deeplink",
            "description",
            "gradient_end",
            "gradient_start",
            "id",
            "image_link",
            "image_link_rectangle",
            "name",
            "parent_id",
            "title_color"
          ],
          "properties": {
            "additional_icons": {
              "type": "array",
              "items": {
                "type": "object",
                "required": [
                  "type",
                  "url"
                ],
                "properties": {
                  "type": {
                    "type": "string",
                    "enum": [
                      "extended",
                      "search_tree"
                    ]
                  },
                  "url": {
                    "type": "string",
                    "format": "uri"
                  }
                }
              }
            },
            "advert": {
              "type": "null"
            },
            "category_type": {
              "type": "string",
              "enum": [
                "default"
              ]
            },
            "deeplink": {
              "type": "null"
            },
            "description": {
              "type": "null"
            },
            "gradient_end": {
              "type": "string",
              "enum": [
                "#f7f8fa",
                "#DBF6FF"
              ]
            },
            "gradient_start": {
              "type": "string",
              "enum": [
                "#f7f8fa",
                "#DBF6FF"
              ]
            },
            "id": {
              "type": "string",
              "j2sEnumRejected": true
            },
            "image_link": {
              "type": "string",
              "format": "uri"
            },
            "image_link_rectangle": {
              "type": "string",
              "format": "uri"
            },
            "name": {
              "type": "string",
              "j2sEnumRejected": true
            },
            "parent_id": {
              "type": "null"
            },
            "title_color": {
              "type": "string",
              "enum": [
                "#302E33"
              ]
            }
          }
        }
      },
      "gradient_end": {
        "type": "null"
      },
      "gradient_start": {
        "type": "null"
      },
      "id": {
        "type": "string",
        "enum": [
          "264C39133"
        ]
      },
      "image_link": {
        "type": "null"
      },
      "name": {
        "type": "string",
        "j2sEnumRejected": true
      },
      "products": {
        "type": "array",
        "items": {}
      },
      "title_color": {
        "type": "null"
      },
      "type": {
        "type": "string",
        "enum": [
          "category_list"
        ]
      }
    }
  }
}