[
  {
    "id": "264C39133",
    "name": "Основной каталог",
    "advert": null,
    "type": "category_list",
    "additional_icons": [],
    "categories": [
      {
        "id": "264C55533",
        "name": "Отдых на природе",
        "advert": null,
        "image_link": "https://catalog-images.x5static.net/category/264C55533-icon-chizhik_6bb3ae9a69b0743f470fde7b52e5b184/345x345.png",
        "gradient_start": "#DBF6FF",
        "gradient_end": "#DBF6FF",
        "title_color": "#302E33",
        "additional_icons": [
          {
            "type": "extended",
            "url": "https://catalog-images.x5static.net/category/264C55533-additional-extended-chizhik_cc32d365712e780c18764a69d8b78521/312x348.png"
          }
        ],
        "deeplink": null,
        "category_type": "default",
        "parent_id": null,
        "description": null,
        "image_link_rectangle": "https://catalog-images.x5static.net/category/264C55533-icon-chizhik_6bb3ae9a69b0743f470fde7b52e5b184/492x336.png"
      },
      {
        "id": "264C39140",
        "name": "Молочные продукты, яйцо",
        "advert": null,
        "image_link": "https://catalog-images.x5static.net/category/264C39140-icon-chizhik_23cb722548929e3c7817d64bf41a9aa6/345x345.png",
        "gradient_start": "#f7f8fa",
        "gradient_end": "#f7f8fa",
        "title_color": "#302E33",
        "additional_icons": [
          {
            "type": "extended",
            "url": "https://catalog-images.x5static.net/category/264C39140-additional-extended-chizhik_98f75071cee7f15a7aec4ea9b878f550/312x348.png"
          }
        ],
        "deeplink": null,
        "category_type": "default",
        "parent_id": null,
        "description": null,
        "image_link_rectangle": "https://catalog-images.x5static.net/category/264C39140-icon-chizhik_23cb722548929e3c7817d64bf41a9aa6/492x336.png"
      },
      {
        "id": "264C39153",
        "name": "Сыры и масло",
        "advert": null,
        "image_link": "https://catalog-images.x5static.net/category/264C39153-icon-chizhik_4b6b1324ac66c4f81c1218e017317186/345x345.png",
        "gradient_start": "#f7f8fa",
        "gradient_end": "#f7f8fa",
        "title_color": "#302E33",
        "additional_icons": [
          {
            "type": "extended",
            "url": "https://catalog-images.x5static.net/category/264C39153-additional-extended-chizhik_8a2c430d22c0c64b451df41d7672b084/312x348.png"
          }
        ],
        "deeplink": null,
        "category_type": "default",
        "parent_id": null,
        "description": null,
        "image_link_rectangle": "https://catalog-images.x5static.net/category/264C39153-icon-chizhik_4b6b1324ac66c4f81c1218e017317186/492x336.png"
      },
      {
        "id": "264C39160",
        "name": "Крупы и макароны",
        "advert": null,
        "image_link": "https://catalog-images.x5static.net/category/264C39160-icon-chizhik_7487f76684212ae49582de151d7f3195/345x345.png",
        "gradient_start": "#f7f8fa",
        "gradient_end": "#f7f8fa",
        "title_color": "#302E33",
        "additional_icons": [
          {
            "type": "extended",
            "url": "https://catalog-images.x5static.net/category/264C39160-additional-extended-chizhik_2fe5e663bfa6ccff8c3a24c57a2cc2e2/312x348.png"
          }
        ],
        "deeplink": null,
        "category_type": "default",
        "parent_id": null,
        "description": null,
        "image_link_rectangle": "https://catalog-images.x5static.net/category/264C39160-icon-chizhik_7487f76684212ae49582de151d7f3195/492x336.png"
      },
      {
        "id": "264C39166",
        "name": "Хлеб и выпечка",
        "advert": null,
        "image_link": "https://catalog-images.x5static.net/category/264C39166-icon-chizhik_b9f8b48f000fac565022b5b993be2947/345x345.png",
        "gradient_start": "#f7f8fa",
        "gradient_end": "#f7f8fa",
        "title_color": "#302E33",
        "additional_icons": [
          {
            "type": "extended",
            "url": "https://catalog-images.x5static.net/category/264C39166-additional-extended-chizhik_6fb9f2401f433265bd1e88901dd686ab/312x348.png"
          }
        ],
        "deeplink": null,
        "category_type": "default",
        "parent_id": null,
        "description": null,
        "image_link_rectangle": "https://catalog-images.x5static.net/category/264C39166-icon-chizhik_b9f8b48f000fac565022b5b993be2947/492x336.png"
      },
      {
        "id": "264C39172",
        "name": "Масло, соусы, специи",
        "advert": null,
        "image_link": "https://catalog-images.x5static.net/category/264C39172-icon-chizhik_b0996f3d8f6af928b18c607feae1fd68/345x345.png",
        "gradient_start": "#f7f8fa",
        "gradient_end": "#f7f8fa",
        "title_color": "#302E33",
        "additional_icons": [
          {
            "type": "extended",
            "url": "https://catalog-images.x5static.net/category/264C39172-additional-extended-chizhik_6fc50c6cd1f2178f027f8e512b6c7f86/312x348.png"
          }
        ],
        "deeplink": null,
        "category_type": "default",
        "parent_id": null,
        "description": null,
        "image_link_rectangle": "https://catalog-images.x5static.net/category/264C39172-icon-chizhik_b0996f3d8f6af928b18c607feae1fd68/492x336.png"
      },
      {
        "id": "264C39207",
        "name": "Консервация",
        "advert": null,
        "image_link": "https://catalog-images.x5static.net/category/264C39207-icon-chizhik_35f45a116769de25ba4a3fb9d848127b/345x345.png",
        "gradient_start": "#f7f8fa",
        "gradient_end": "#f7f8fa",
        "title_color": "#302E33",
        "additional_icons": [
          {
            "type": "extended",
            "url": "https://catalog-images.x5static.net/category/264C39207-additional-extended-chizhik_acae5eee407a7180fd4c6e57634246eb/312x348.png"
          }
        ],
        "deeplink": null,
        "category_type": "default",
        "parent_id": null,
        "description": null,
        "image_link_rectangle": "https://catalog-images.x5static.net/category/264C39207-icon-chizhik_35f45a116769de25ba4a3fb9d848127b/492x336.png"
      },
      {
        "id": "264C39184",
        "name": "Мясо и птица",
        "advert": null,
        "image_link": "https://catalog-images.x5static.net/category/264C39184-icon-chizhik_4695d4a1e97e349a6130dfcb58c218b2/345x345.png",
        "gradient_start": "#f7f8fa",
        "gradient_end": "#f7f8fa",
        "title_color": "#302E33",
        "additional_icons": [
          {
            "type": "extended",
            "url": "https://catalog-images.x5static.net/category/264C39184-additional-extended-chizhik_4a631c5420aae504a3d44be158bc4ce4/312x348.png"
          }
        ],
        "deeplink": null,
        "category_type": "default",
        "parent_id": null,
        "description": null,
        "image_link_rectangle": "https://catalog-images.x5static.net/category/264C39184-icon-chizhik_4695d4a1e97e349a6130dfcb58c218b2/492x336.png"
      },
      {
        "id": "264C39179",
        "name": "Мясная гастрономия",
        "advert": null,
        "image_link": "https://catalog-images.x5static.net/category/264C39179-icon-chizhik_da3738229b8d459a550c8cc838f5571a/345x345.png",
        "gradient_start": "#f7f8fa",
        "gradient_end": "#f7f8fa",
        "title_color": "#302E33",
        "additional_icons": [
          {
            "type": "extended",
            "url": "https://catalog-images.x5static.net/category/264C39179-additional-extended-chizhik_332c7bd08d4262a7c3c94ba95646db3e/312x348.png"
          },
          {
            "type": "search_tree",
            "url": "https://catalog-images.x5static.net/category/264C39179-additional-search-tree-chizhik_a98d81548a56f7c20d49cd2aa29bd602/144x144.png"
          }
        ],
        "deeplink": null,
        "category_type": "default",
        "parent_id": null,
        "description": null,
        "image_link_rectangle": "https://catalog-images.x5static.net/category/264C39179-icon-chizhik_da3738229b8d459a550c8cc838f5571a/492x336.png"
      },
      {
        "id": "264C39189",
        "name": "Рыба и морепродукты",
        "advert": null,
        "image_link": "https://catalog-images.x5static.net/category/264C39189-icon-chizhik_12b7b915ac2f3cf272cda0ded256843a/345x345.png",
        "gradient_start": "#f7f8fa",
        "gradient_end": "#f7f8fa",
        "title_color": "#302E33",
        "additional_icons": [
          {
            "type": "extended",
            "url": "https://catalog-images.x5static.net/category/264C39189-additional-extended-chizhik_12d8ff2cf1ec00b693e77f78517100c9/312x348.png"
          },
          {
            "type": "search_tree",
            "url": "https://catalog-images.x5static.net/category/264C39189-additional-search-tree-chizhik_d01d970a4e8b7fde131f0dced0ab6ed6/144x144.png"
          }
        ],
        "deeplink": null,
        "category_type": "default",
        "parent_id": null,
        "description": null,
        "image_link_rectangle": "https://catalog-images.x5static.net/category/264C39189-icon-chizhik_12b7b915ac2f3cf272cda0ded256843a/492x336.png"
      },
      {
        "id": "264C39201",
        "name": "Замороженные продукты",
        "advert": null,
        "image_link": "https://catalog-images.x5static.net/category/264C39201-icon-chizhik_5958ded4ddb53da052d6dabf3304e301/345x345.png",
        "gradient_start": "#f7f8fa",
        "gradient_end": "#f7f8fa",
        "title_color": "#302E33",
        "additional_icons": [
          {
            "type": "extended",
            "url": "https://catalog-images.x5static.net/category/264C39201-additional-extended-chizhik_c73e8f444cce581de4dfc7256ee04c03/312x348.png"
          },
          {
            "type": "search_tree",
            "url": "https://catalog-images.x5static.net/category/264C39201-additional-search-tree-chizhik_13745c12a8c5adb74baa8a95f2c4ebaa/144x144.png"
          }
        ],